{
  "id": 1,
  "name": "Bitcoin",
  "symbol": "BTC",
  "slug": "bitcoin",
  "cmcRank": 1,
  "marketPairCount": 11849,
  "circulatingSupply": 19800043,
  "selfReportedCirculatingSupply": 0,
  "totalSupply": 19800043,
  "maxSupply": 21000000,
  "ath": 108268.44708043612,
  "atl": 0.04864654,
  "high24h": 97254.7760088479,
  "low24h": 93690.72560393492,
  "isActive": 1,
  "lastUpdated": "2024-12-23T10:45:00.000Z",
  "dateAdded": "2010-07-13T00:00:00.000Z",
  "quotes": [
    {
      "name": "USD",
      "price": 96008.95822005007,
      "volume24h": 52253739602.640274,
      "marketCap": 1900981501142.1948,
      "lastUpdated": "2024-12-23T10:45:00.000Z"
    }
  ],
  "isAudited": false,
  "auditInfoList": [],
  "badges": [1]
}